{
  "schema": "ni.amendment.v0",
  "id": "AMEND-001",
  "title": "Define ni v1 planning contract",
  "reason": "Task 027 dogfoods ni by replacing the prior v0-shaped locked plan with the v1 planning contract roadmap.",
  "affected_docs": [
    "docs/plan/00_project_brief.md",
    "docs/plan/01_actors_outcomes.md",
    "docs/plan/02_capabilities.md",
    "docs/plan/03_interaction_contract.md",
    "docs/plan/04_domain_state.md",
    "docs/plan/05_constraints.md",
    "docs/plan/06_risks_security.md",
    "docs/plan/07_evaluation_contract.md",
    "docs/plan/08_delivery_operation.md",
    "docs/plan/09_execution_strategy.md",
    "docs/plan/10_open_questions.md",
    "docs/plan/11_decision_log.md",
    ".ni/contract.json"
  ],
  "affected_contract_ids": [
    "CAP-007",
    "CAP-008",
    "CAP-009",
    "CAP-010",
    "CAP-011",
    "CAP-012",
    "CAP-013",
    "CAP-014",
    "CAP-015",
    "REQ-007",
    "REQ-008",
    "REQ-009",
    "REQ-010",
    "REQ-011",
    "REQ-012",
    "REQ-013",
    "REQ-014",
    "REQ-015",
    "DEC-004",
    "DEC-005",
    "DEC-006",
    "DEC-007",
    "DEC-008"
  ],
  "proposed_changes": [
    "Expand docs/plan to the v1 roadmap while preserving the ni-kernel boundary.",
    "Add accepted contract traceability for product types, downstream targets, exports, feedback, pressure, harness candidates, amendment/relock, and collaboration checks.",
    "Resolve obsolete non-blocking open questions so readiness can be determined by ni status without deferrals."
  ],
  "risk_impact": "Adds explicit high-severity mitigations for export, feedback, pressure, harness, and relock boundary risks.",
  "readiness_impact": "Expected to keep ni status READY because all accepted capabilities map to requirements, evaluations, artifacts, and mitigated high-severity risks.",
  "created_from_feedback_refs": [],
  "created_from_pressure_refs": [],
  "status": "applied",
  "created_at": "2026-05-26T09:45:34Z",
  "applied_at": "2026-05-26T09:49:40Z",
  "source_lock_hash": "78ffdfa039808b32341a4621d1360bec16c5f1017ef5bca2631d7df7f121a9d8"
}
