{
  "schema": "ni.amendment.v0",
  "id": "AMEND-014",
  "title": "Lock v0.4.0 post-release state",
  "reason": "Lock the v0.4.0 post-release state after release asset verification, curl installer verification, and install docs sync, while preserving Planned Homebrew status, model workspace packs as UX, and the pre-runtime ni-kernel boundary.",
  "affected_docs": [
    "docs/plan/00_project_brief.md",
    "docs/plan/02_capabilities.md",
    "docs/plan/05_constraints.md",
    "docs/plan/06_risks_security.md",
    "docs/plan/07_evaluation_contract.md",
    "docs/plan/08_delivery_operation.md",
    "docs/plan/11_decision_log.md",
    ".ni/contract.json"
  ],
  "affected_contract_ids": [
    "CAP-020",
    "REQ-020",
    "DEC-016",
    "RISK-017",
    "EVAL-024",
    "NG-012",
    "ART-053",
    "ART-054",
    "ART-055",
    "ART-056"
  ],
  "proposed_changes": [
    "Add CAP-020 for the verified v0.4.0 post-release distribution state.",
    "Record v0.4.0 release binary and curl installer availability after verification, install docs current-release sync, Planned / deferred Homebrew status, and model workspace packs as UX rather than CLI authority.",
    "Add REQ-020, EVAL-024, RISK-017, DEC-016, NG-012, and post-release artifacts while preserving prompt-only ni run behavior and the pre-runtime ni-kernel boundary."
  ],
  "risk_impact": "Adds a high-severity post-release overclaim risk so verified release/curl availability cannot drift into Homebrew availability, package-manager claims, runtime execution, codex exec, tag publishing, or model-pack authority claims.",
  "readiness_impact": "Expected to become READY after docs explain the accepted cli delivery surface and CAP-020 is accepted with a linked requirement, evaluation, mitigated high-severity risk, artifacts, non-goal, and no blocker questions.",
  "created_from_feedback_refs": [],
  "created_from_pressure_refs": [],
  "status": "applied",
  "created_at": "2026-05-29T07:21:08Z",
  "applied_at": "2026-05-29T07:24:15Z",
  "source_lock_hash": "bfc2909fecb0481f6e14c7933351a25c9b84e4b10b89780759a054697ac767ba"
}
