{
  "schema": "ni.amendment.v0",
  "id": "AMEND-007",
  "title": "Lock v0.3 product packaging plan",
  "reason": "Update ni's own locked planning contract to reflect the v0.3 product packaging direction across README pamphlet, visual identity, distribution, and model workspace pack surfaces.",
  "affected_docs": [
    "docs/plan/00_project_brief.md",
    "docs/plan/01_actors_outcomes.md",
    "docs/plan/02_capabilities.md",
    "docs/plan/05_constraints.md",
    "docs/plan/06_risks_security.md",
    "docs/plan/07_evaluation_contract.md",
    "docs/plan/08_delivery_operation.md",
    "docs/plan/09_execution_strategy.md",
    "docs/plan/11_decision_log.md",
    ".ni/contract.json",
    ".ni/session.json"
  ],
  "affected_contract_ids": [
    "CAP-017",
    "REQ-017",
    "DEC-011",
    "RISK-013",
    "EVAL-019",
    "NG-006",
    "NG-007",
    "NG-008",
    "NG-009",
    "ART-031",
    "ART-032",
    "ART-033",
    "ART-034",
    "ART-035",
    "ART-036",
    "ART-037",
    "ART-038",
    "ART-039",
    "ART-040"
  ],
  "proposed_changes": [
    "Record README as a product pamphlet with technical depth moved to docs and harness-neutral hero language.",
    "Accept SVG-first visual identity with optional generated social image assets.",
    "Require factual distribution language: release binaries for non-Go users before curl or package-manager availability claims.",
    "Define Codex- and Claude-style model workspace packs as planning UX and no-terminal mode as assisted unless exact CLI proof is supplied."
  ],
  "risk_impact": "Adds RISK-013 to prevent v0.3 packaging, distribution, model pack, and no-terminal copy from outrunning implemented proof or drifting into runtime-adapter claims.",
  "readiness_impact": "Expected to remain READY because CAP-017 has linked requirement, evaluation, high-severity risk mitigation, artifacts, non-goals, and no blocker questions.",
  "created_from_feedback_refs": [],
  "created_from_pressure_refs": [],
  "status": "applied",
  "created_at": "2026-05-27T12:41:50Z",
  "applied_at": "2026-05-27T12:45:12Z",
  "source_lock_hash": "b91f6afd41870a2965e2979abd9d979d980482a02b841300bb5b82aa7abe70c4"
}
