{
  "schema": "ni.amendment.v0",
  "id": "AMEND-004",
  "title": "Preserve default software fixture metadata",
  "reason": "The root ni contract is also used by contract package tests as the canonical default software/CLI fixture; v0.2 conversation-authoring scope is captured in purpose, capabilities, requirements, decisions, risks, evaluations, and docs without changing fixture metadata.",
  "affected_docs": [
    ".ni/contract.json"
  ],
  "affected_contract_ids": [
    "REQ-008",
    "CAP-005",
    "REQ-005",
    "DEC-009"
  ],
  "proposed_changes": [
    "Restore product_type to software and delivery_surfaces to cli so the root checked-in contract remains the canonical default fixture.",
    "Keep the v0.2 conversation-authoring plan in project purpose, CAP-005, REQ-005, DEC-009, RISK-011, EVAL-006, and docs/plan."
  ],
  "risk_impact": "No weakening of conversation-authoring scope; this preserves existing software/CLI fixture expectations while leaving the v0.2 authoring decisions and no contract add/list/set boundary intact.",
  "readiness_impact": "Expected to remain READY because accepted capabilities, linked evaluations, artifacts, and mitigated high-severity risks are unchanged.",
  "created_from_feedback_refs": [],
  "created_from_pressure_refs": [],
  "status": "applied",
  "created_at": "2026-05-26T13:54:38Z",
  "applied_at": "2026-05-26T13:55:00Z",
  "source_lock_hash": "bdcf3a8c40123b1a311a58a4ab42da982db5881d083a2e195ceb2614be3b7ecd"
}
