{
  "schema": "ni.amendment.v0",
  "id": "AMEND-003",
  "title": "Center v0.2 on conversation authoring",
  "reason": "Task 052 updates ni's own locked plan so v0.2 is centered on conversation-driven authoring rather than user-entered CLI contract editing commands.",
  "affected_docs": [
    "docs/plan/00_project_brief.md",
    "docs/plan/01_actors_outcomes.md",
    "docs/plan/02_capabilities.md",
    "docs/plan/03_interaction_contract.md",
    "docs/plan/04_domain_state.md",
    "docs/plan/05_constraints.md",
    "docs/plan/06_risks_security.md",
    "docs/plan/07_evaluation_contract.md",
    "docs/plan/08_delivery_operation.md",
    "docs/plan/09_execution_strategy.md",
    "docs/plan/11_decision_log.md",
    ".ni/contract.json",
    ".ni/session.json"
  ],
  "affected_contract_ids": [
    "NG-005",
    "CAP-001",
    "CAP-002",
    "CAP-003",
    "CAP-004",
    "CAP-005",
    "REQ-001",
    "REQ-002",
    "REQ-003",
    "REQ-004",
    "REQ-005",
    "DEC-009",
    "RISK-011",
    "EVAL-001",
    "EVAL-005",
    "EVAL-006",
    "ART-005",
    "ART-020",
    "ART-021"
  ],
  "proposed_changes": [
    "Center the v0.2 purpose, success definition, delivery model, and interaction contract on ni init followed by model-user conversation through ni-start.",
    "Keep ni status, ni-end, ni relock, and ni-run as deterministic CLI gates rather than model authority.",
    "Record that contract add/list/set commands are not part of the v0.2 primary authoring UX."
  ],
  "risk_impact": "Adds RISK-011 for CLI contract editing displacing conversation authoring and mitigates it by keeping v0.2 authoring in ni-start synchronized docs and contract updates.",
  "readiness_impact": "Expected to remain READY because accepted capabilities still map to requirements, evaluations, artifacts, and mitigated high-severity risks.",
  "created_from_feedback_refs": [],
  "created_from_pressure_refs": [],
  "status": "applied",
  "created_at": "2026-05-26T13:51:40Z",
  "applied_at": "2026-05-26T13:53:52Z",
  "source_lock_hash": "bea43d93b8532224b13a0e8ddbee461ac73d9fef92092e182051008aeb22cfc7"
}
