{
  "schema": "ni.amendment.v0",
  "id": "AMEND-006",
  "title": "Lock v0.2 differentiation plan",
  "reason": "Update ni's own locked planning contract to reflect the post-053 v0.2 differentiation direction.",
  "affected_docs": [
    "docs/plan/00_project_brief.md",
    "docs/plan/01_actors_outcomes.md",
    "docs/plan/02_capabilities.md",
    "docs/plan/05_constraints.md",
    "docs/plan/06_risks_security.md",
    "docs/plan/07_evaluation_contract.md",
    "docs/plan/08_delivery_operation.md",
    "docs/plan/11_decision_log.md",
    ".ni/contract.json",
    ".ni/session.json"
  ],
  "affected_contract_ids": [
    "CAP-016",
    "REQ-016",
    "DEC-010",
    "RISK-012",
    "EVAL-018",
    "ART-022",
    "ART-023",
    "ART-024",
    "ART-025",
    "ART-026",
    "ART-027",
    "ART-028",
    "ART-029",
    "ART-030"
  ],
  "proposed_changes": [
    "Record the Project Intent Compiler positioning and Intent Lock Protocol mechanism in the active plan.",
    "Add the v0.2 proof assets as accepted differentiation scope.",
    "Keep the proof assets pre-runtime and explicitly outside execution harness behavior."
  ],
  "risk_impact": "Adds RISK-012 to prevent proof assets from drifting into runtime execution claims.",
  "readiness_impact": "Expected to remain READY after docs and contract sync because the new capability has linked requirement, evaluation, risk mitigation, and artifacts.",
  "created_from_feedback_refs": [],
  "created_from_pressure_refs": [],
  "status": "applied",
  "created_at": "2026-05-27T01:35:42Z",
  "applied_at": "2026-05-27T01:37:46Z",
  "source_lock_hash": "b0b4d582d8126ed40d11d5fd0b55e2bc533486719a1b95bd8972eacf4c121aa8"
}
